titre,url
"La faillite de la démocratie aux Etats-Unis, épisode 2 : la disparité des règles de vote selon les Etats",https://www.lemonde.fr/international/article/2020/10/13/les-failles-de-la-democratie-americaine-episode-2-la-disparite-des-regles-de-vote-risque-de-creer-la-confusion_6055826_3210.html
Covid-19 : ces nombres montrant la « probabilité de survie » des personnes infectées sont trompeurs,https://www.lemonde.fr/les-decodeurs/article/2020/10/13/covid-19-ces-chiffres-montrant-la-probabilite-de-survie-des-personnes-infectees-sont-trompeurs_6055868_4355770.html
L’UE adopte des critères non contraignants pour les zones à risques et les restrictions de voyage,https://www.lemonde.fr/planete/article/2020/10/13/coronavirus-adoption-de-criteres-communs-pour-les-restrictions-de-voyage-dans-l-ue_6055851_3244.html
Des heures d’attente et des médicaments hors de prix : la corruption de la santé en Amérique latine à l’heure du Covid-19,https://www.lemonde.fr/international/article/2020/10/13/covid-19-la-pandemie-revele-l-ampleur-de-la-corruption-des-systemes-de-sante-en-amerique-latine_6055833_3210.html
"La réforme des retraites, une équation insoluble pour le gouvernement",https://www.lemonde.fr/politique/article/2020/10/13/reforme-des-retraites-l-equation-insoluble_6055839_823448.html
Qu’est-ce que la 5G va changer pour les particuliers ?,https://www.lemonde.fr/les-decodeurs/article/2020/09/19/qu-est-ce-que-la-5g-va-changer-pour-les-particuliers_6052813_4355770.html
"Notre voix, un instrument si fragile",https://www.lemonde.fr/sciences/article/2020/10/13/notre-voix-un-instrument-si-fragile_6055809_1650684.html
"Bars, fêtes, piscines et salles de sports… quelles sont les restrictions dans votre ville ou département ?",https://www.lemonde.fr/les-decodeurs/article/2020/09/24/coronavirus-zones-d-alerte-bars-fetes-ce-que-l-on-sait-des-nouvelles-restrictions_6053500_4355770.html
En cartes et graphiques : visualisez l’évolution de l’épidémie de Covid-19 en France et dans le monde,https://www.lemonde.fr/les-decodeurs/article/2020/05/05/coronavirus-age-mortalite-departements-pays-suivez-l-evolution-de-l-epidemie-en-cartes-et-graphiques_6038751_4355770.html
"« Si on ne fait rien, dans un mois c’est la catastrophe » : face à la deuxième vague, quelles sont les options du gouvernement ?",https://www.lemonde.fr/planete/article/2020/10/13/reconfinement-couvre-feu-face-a-la-deuxieme-vague-quelles-sont-les-options-du-gouvernement_6055782_3244.html
« Je ne m’occupe plus que du Covid » : paroles d’infirmiers et de médecins scolaires,https://www.lemonde.fr/education/article/2020/10/12/je-ne-m-occupe-plus-que-du-covid-infirmiers-et-medecins-scolaires-en-premiere-ligne_6055731_1473685.html
"Les lycéennes en minijupe, un mauvais symbole du respect des femmes au Japon",https://www.lemonde.fr/les-decodeurs/article/2020/10/13/les-lyceennes-en-minijupe-un-mauvais-symbole-du-respect-des-femmes-au-japon_6055862_4355770.html
"Les milliards d’euros du plan de relance pleuvent, mais les montants réels ne suivent pas toujours",https://www.lemonde.fr/idees/article/2020/10/13/les-trompe-l-il-du-plan-de-relance_6055788_3232.html
Grippe saisonnière : qui est incité à se faire vacciner et pourquoi,https://www.lemonde.fr/societe/article/2020/10/13/la-campagne-de-vaccination-contre-la-grippe-saisonniere-debute-en-pleine-deuxieme-vague-de-covid-19_6055834_3224.html
Le FMI prévoit une reprise économique mondiale « longue et difficile »,https://www.lemonde.fr/economie/article/2020/10/13/le-fmi-prevoit-une-reprise-economique-mondiale-longue-et-difficile_6055859_3234.html
Les fausses promesses de l’hybride rechargeable,https://www.lemonde.fr/m-le-mag/article/2020/10/13/l-hybride-rechargeable-au-banc-des-accuses_6055775_4500055.html
L’UE s’apprête à sanctionner « vite » Moscou pour l’empoisonnement de Navalny,https://www.lemonde.fr/international/article/2020/10/13/l-ue-s-apprete-a-sanctionner-vite-moscou-pour-l-empoisonnement-de-navalny_6055829_3210.html
Des salariés bloquent les expéditions de carburant de la raffinerie Total de Grandpuits,https://www.lemonde.fr/economie/article/2020/10/13/des-salaries-bloquent-les-expeditions-de-carburant-de-la-raffinerie-total-de-grandpuits_6055853_3234.html
Les salades grecques d’EDF Renouvelables,https://www.lemonde.fr/economie/article/2020/10/13/les-salades-grecques-d-edf-renouvelables_6055825_3234.html
"« Il y a autant de chances que je vote Biden que Mickey Mouse » : avant la présidentielle, retour en Amérique profonde",https://www.lemonde.fr/international/article/2020/10/13/election-presidentielle-aux-etats-unis-la-campagne-vue-de-la-campagne_6055795_3210.html
"Un an après l’affaire du camion charnier, enquête sur le marché macabre du trafic de migrants",https://www.lemonde.fr/societe/article/2020/10/12/un-an-apres-l-affaire-du-camion-charnier-enquete-sur-le-marche-macabre-du-trafic-de-migrants_6055654_3224.html
"Stepanakert, capitale fantôme du Haut-Karabakh",https://www.lemonde.fr/international/article/2020/10/12/stepanakert-capitale-fantome-du-haut-karabakh_6055714_3210.html
Brexit : la nécessité d’un accord,https://www.lemonde.fr/idees/article/2020/10/13/brexit-la-necessite-d-un-accord_6055841_3232.html
"Chez British Airways, « duel d’Espagnols dans le ciel anglais »",https://www.lemonde.fr/economie/article/2020/10/13/chez-british-airways-duel-d-espagnols-dans-le-ciel-anglais_6055838_3234.html
« Le clivage entre les élites et le peuple se construit à l’école »,https://www.lemonde.fr/societe/article/2020/10/13/le-clivage-entre-les-elites-et-le-peuple-se-construit-a-l-ecole_6055801_3224.html
"Non, Clint Eastwood n’est pas l’auteur de cette lettre en faveur de Donald Trump",https://www.lemonde.fr/les-decodeurs/article/2020/10/13/non-clint-eastwood-n-est-pas-l-auteur-de-cette-lettre-en-faveur-de-donald-trump_6055867_4355770.html
"La faillite de la démocratie aux Etats-Unis, épisode 2 : la disparité des règles de vote selon les Etats  ",https://www.lemonde.fr/international/article/2020/10/13/les-failles-de-la-democratie-americaine-episode-2-la-disparite-des-regles-de-vote-risque-de-creer-la-confusion_6055826_3210.html
Le bilan économique de Donald Trump anéanti par le Covid-19  ,https://www.lemonde.fr/idees/article/2020/10/12/le-bilan-economique-de-trump-aneanti-par-le-covid_6055718_3232.html
Des chevaux mutilés et un ennemi invisible : propriétaires et éleveurs inquiets de devenir la prochaine « cible à abattre »,https://www.lemonde.fr/planete/article/2020/10/07/en-bretagne-proprietaires-et-eleveurs-inquiets-de-voir-leurs-chevaux-mutiles-par-un-ennemi-invisible_6055037_3244.html
"L’infectiologue Didier Pittet, « docteur Mains propres »  ",https://www.lemonde.fr/planete/article/2020/10/13/l-infectiologue-didier-pittet-docteur-mains-propres_6055821_3244.html
"« Si on ne fait rien, dans un mois c’est la catastrophe » : face à la deuxième vague, quelles sont les options du gouvernement ?  ",https://www.lemonde.fr/planete/article/2020/10/13/reconfinement-couvre-feu-face-a-la-deuxieme-vague-quelles-sont-les-options-du-gouvernement_6055782_3244.html
Frédéric Ducarme : « L’idée de nature est un concept très... culturel »,https://www.lemonde.fr/sciences/article/2020/10/10/frederic-ducarme-l-idee-de-nature-est-un-concept-tres-culturel_6055580_1650684.html
Covid-19 : la consommation de médicaments fortement modifiée pendant le confinement… et après  ,https://www.lemonde.fr/sciences/article/2020/10/09/covid-19-la-consommation-de-medicaments-fortement-modifiee-pendant-le-confinement-et-apres_6055378_1650684.html
Humains et chiens se regardent différemment  ,https://www.lemonde.fr/sciences/video/2020/10/09/humains-et-chiens-se-regardent-differemment_6055373_1650684.html
"Sur la 5G, ce qui est vrai, ce qui est faux et ce qu’on ne sait pas encore",https://www.lemonde.fr/les-decodeurs/article/2020/09/24/5g-le-vrai-le-faux-et-ce-qu-on-ne-sait-pas-encore_6053447_4355770.html
"Elections sénatoriales : la droite renforcée, LRM stable et le retour des écologistes  ",https://www.lemonde.fr/les-decodeurs/article/2020/09/27/senatoriales-2020-retrouvez-les-resultats-du-scrutin_6053808_4355770.html
"Par âge ou département, visualisez l’évolution des contaminations en France  ",https://www.lemonde.fr/les-decodeurs/article/2020/07/17/coronavirus-dans-quels-departements-teste-t-on-le-plus-ou-y-a-t-il-le-plus-de-nouveaux-cas-detectes_6046543_4355770.html
"La faillite de la démocratie aux Etats-Unis, épisode 2 : la disparité des règles de vote selon les Etats",https://www.lemonde.fr/international/article/2020/10/13/les-failles-de-la-democratie-americaine-episode-2-la-disparite-des-regles-de-vote-risque-de-creer-la-confusion_6055826_3210.html
"En Bulgarie, les manifestations contre « la dictature de la mafia » ne s’arrêtent pas  ",https://www.lemonde.fr/international/article/2020/10/13/en-bulgarie-les-manifestations-contre-la-dictature-de-la-mafia-ne-s-arretent-pas_6055794_3210.html
"Face à la deuxième vague de Covid-19, Moscou rechigne à imposer des mesures drastiques  ",https://www.lemonde.fr/international/article/2020/10/13/face-a-la-deuxieme-vague-de-covid-19-moscou-rechigne-a-imposer-des-mesures-drastiques_6055830_3210.html
Mesures Covid-19 : le gouvernement examinera mercredi les données épidémiologiques,https://www.lemonde.fr/planete/article/2020/10/12/jean-castex-n-exclut-pas-des-reconfinements-locaux-en-france_6055691_3244.html
"Pourquoi Emmanuel Macron a choisi Dominique Simonnot, du « Canard enchaîné », comme contrôleuse des prisons  ",https://www.lemonde.fr/societe/article/2020/10/13/pourquoi-macron-a-choisi-une-journaliste-du-canard-enchaine-comme-controleuse-des-prisons_6055813_3224.html
"La réforme des retraites, une équation insoluble pour le gouvernement  ",https://www.lemonde.fr/politique/article/2020/10/13/reforme-des-retraites-l-equation-insoluble_6055839_823448.html
"« Ce n’est pas la guerre ici, ce n’est pas Bagdad » : à Champigny, le désarroi des habitants après l’attaque du commissariat",https://www.lemonde.fr/societe/article/2020/10/13/champigny-sur-marne-apres-l-attaque-du-commissariat-le-desarroi-des-habitants_6055787_3224.html
L’organisme HLM de Rennes sanctionné pour avoir utilisé le fichier des locataires à des fins politiques  ,https://www.lemonde.fr/societe/article/2020/10/12/l-organisme-hlm-de-rennes-sanctionne-pour-avoir-utilise-le-fichier-des-locataires-a-des-fins-politiques_6055749_3224.html
La solitude et la « rigidité » du « djihadiste au marteau » au premier jour de son procès  ,https://www.lemonde.fr/societe/article/2020/10/13/la-solitude-et-la-rigidite-du-djihadiste-au-marteau-au-premier-jour-de-son-proces_6055781_3224.html
Les majors du pétrole face à leurs engagements climatiques,https://www.lemonde.fr/economie/article/2020/10/13/petrole-les-majors-face-a-leurs-engagements-climatiques_6055786_3234.html
Les salades grecques d’EDF Renouvelables  ,https://www.lemonde.fr/economie/article/2020/10/13/les-salades-grecques-d-edf-renouvelables_6055825_3234.html
Nouvelle partie de poker menteur chez Lagardère  ,https://www.lemonde.fr/economie/article/2020/10/13/nouvelle-partie-de-poker-menteur-chez-lagardere_6055845_3234.html
Que deviennent les informations collectées par les restaurants dans le cadre des mesures sanitaires ?,https://www.lemonde.fr/pixels/article/2020/10/07/cahier-de-rappel-covid-19-dans-les-restaurants-que-dit-la-loi-sur-les-donnees-des-clients_6055155_4408996.html
"On a testé : « Star Wars : Squadrons », un simulateur de bataille spatiale qui manque de carburant  ",https://www.lemonde.fr/pixels/article/2020/10/09/on-a-teste-star-wars-squadrons-un-simulateur-de-bataille-spatiale-qui-manque-de-carburant_6055371_4408996.html
Casser « Big Tech »  ,https://www.lemonde.fr/pixels/article/2020/10/13/casser-big-tech_6055799_4408996.html
"Béatrice Agenin, le théâtre et son double",https://www.lemonde.fr/culture/article/2020/10/12/beatrice-agenin-le-theatre-et-son-double_6055684_3246.html
Exposition : influenceuses beautés de l’époque Edo  ,https://www.lemonde.fr/culture/article/2020/10/12/exposition-influenceuses-beautes-de-l-epoque-edo_6055681_3246.html
La bande des « Dix pour cent » à la conquête du monde  ,https://www.lemonde.fr/culture/article/2020/10/09/la-bande-des-dix-pour-cent-a-la-conquete-du-monde_6055458_3246.html
"Deux équipes abandonnent le Tour d’Italie, rattrapées par le Covid-19",https://www.lemonde.fr/sport/article/2020/10/13/tour-d-italie-l-equipe-mitchelton-scott-rattrapee-par-le-covid-19-se-retire_6055837_3242.html
"Roland-Garros est fini, rendez-nous le vrai « Roland »  ",https://www.lemonde.fr/tennis/article/2020/10/12/roland-garros-est-fini-rendez-nous-le-vrai-roland_6055669_1616659.html
"« Les remises de dette des pays en développement ne doivent plus être considérées comme un drame, mais comme un partage des risques »",https://www.lemonde.fr/idees/article/2020/10/12/les-remises-de-dette-des-pays-en-developpement-ne-doivent-plus-etre-considerees-comme-un-drame-mais-comme-un-partage-des-risques_6055679_3232.html
Esquisser le « Mali nouveau » : la délicate mission du premier ministre Moctar Ouane  ,https://www.lemonde.fr/afrique/article/2020/10/12/esquisser-le-mali-nouveau-la-delicate-mission-du-premier-ministre-moctar-ouane_6055765_3212.html
"Mohamed Ramadan, le bad boy des écrans égyptiens  ",https://www.lemonde.fr/blog/filiu/2020/10/11/mohamed-ramadan-le-bad-boy-des-ecrans-egyptiens/
Nicolas Hulot et Frédéric Lenoir : « Il faut absolument sortir de cette logique absurde de croissance infinie dans un monde fini »,https://www.lemonde.fr/le-monde-des-religions/article/2020/10/04/nicolas-hulot-et-frederic-lenoir-il-faut-absolument-sortir-de-cette-logique-absurde-de-croissance-infinie-dans-un-monde-fini_6054685_6038514.html
"Voltaire, premier islamo-gauchiste de l’histoire ?  ",https://www.lemonde.fr/le-monde-des-religions/article/2020/10/10/voltaire-premier-islamo-gauchiste-de-l-histoire_6055512_6038514.html
« Il faut que la théologie redevienne un bien commun et se développe dans les universités publiques »  ,https://www.lemonde.fr/idees/article/2020/10/11/il-faut-que-la-theologie-redevienne-un-bien-commun-et-se-developpe-dans-les-universites-publiques_6055596_3232.html
"« L’Etoffe des héros », « La Flamme », « Emily in Paris »... les séries de la semaine",https://www.lemonde.fr/culture/article/2020/10/13/l-etoffe-des-heros-la-flamme-emily-in-paris-les-series-de-la-semaine_6055769_3246.html
"Janis Joplin en BD, l’abécédaire d’Eddy Mitchell… Sept livres sur la musique  ",https://www.lemonde.fr/musiques/article/2020/10/12/janis-joplin-en-bd-l-abecedaire-d-eddy-mitchell-sept-livres-sur-la-musique_6055645_1654986.html
"Un promeneur solitaire, un roi et des nettoyeurs du Web : nos choix de lecture  ",https://www.lemonde.fr/livres/article/2020/10/08/un-promeneur-solitaire-un-roi-et-des-nettoyeurs-du-web-nos-choix-de-lecture_6055186_3260.html
"Jean Genet, ses écrits secrets enfin révélés",https://www.lemonde.fr/m-le-mag/article/2020/10/09/jean-genet-ses-ecrits-secrets-enfin-reveles_6055442_4500055.html
Le tartan se tient à carreaux  ,https://www.lemonde.fr/m-le-mag/article/2020/10/12/le-tartan-se-tient-a-carreaux_6055762_4500055.html
Le lapin chasseur : la recette d’Antoine Gerbelle,https://www.lemonde.fr/m-le-mag/article/2020/10/09/le-lapin-chasseur-la-recette-d-antoine-gerbelle_6055449_4500055.html
Le pâté bourbonnais : la recette de Loïc Ballet  ,https://www.lemonde.fr/m-styles/article/2020/10/02/le-pate-bourbonnais-la-recette-de-loic-ballet_6054546_4497319.html
La salade 100 % jardin : la recette de Romain Raimbault  ,https://www.lemonde.fr/les-recettes-du-monde/article/2020/09/11/la-salade-100-jardin-la-recette-de-romain-raimbault_6051807_5324493.html
Les meilleurs ordinateurs portables professionnels,https://www.lemonde.fr/guides-d-achat/article/2019/07/19/quel-ordinateur-portable-professionnel-choisir_5491363_5306571.html
"Les meilleures montres connectées, bracelets connectés et montres de running  ",https://www.lemonde.fr/guides-d-achat/article/2019/11/08/les-meilleurs-montres-connectees-bracelets-connectes-et-montres-de-running_6018557_5306571.html
"Dans l’enseignement supérieur, l’heure de gloire des « ingénieurs pédagogiques »",https://www.lemonde.fr/campus/article/2020/10/13/dans-l-enseignement-superieur-l-heure-de-gloire-des-ingenieurs-pedagogiques_6055792_4401467.html
O21 | Retrouvez la vidéo de la conférence « Bien s’orienter dans un monde qui se transforme »  ,https://www.lemonde.fr/campus/live/2020/10/09/o21-rennes-participez-en-direct-a-la-conference-bien-s-orienter-dans-un-monde-qui-se-transforme_6055464_4401467.html
La fusion en cours fait rater sa rentrée à l’université de Paris  ,https://www.lemonde.fr/societe/article/2020/10/13/la-fusion-en-cours-fait-rater-sa-rentree-a-l-universite-de-paris_6055857_3224.html
Retraite : un ancien salarié sur dix a vu sa pension modifiée en octobre (parfois à la baisse),https://www.lemonde.fr/argent/article/2020/10/13/retraite-un-ancien-salarie-sur-dix-a-vu-sa-pension-modifiee-en-octobre-parfois-a-la-baisse_6055856_1657007.html
Faut-il déclarer aux impôts l’argent prêté par un proche ?  ,https://www.lemonde.fr/argent/article/2020/10/13/faut-il-declarer-aux-impots-l-argent-prete-par-un-proche_6055800_1657007.html
« Le Monde » a décerné ses Prix de l’innovation urbaine 2020,https://www.lemonde.fr/smart-cities/article/2020/06/29/le-monde-a-decerne-ses-prix-de-l-innovation-urbaine-2020_6044603_4811534.html
"Boribana, le bidonville d’Abidjan sacrifié sur l’autel du développement  ",https://www.lemonde.fr/afrique/article/2020/10/12/boribana-le-bidonville-d-abidjan-sacrifie-sur-l-autel-du-developpement_6055753_3212.html
"« Face à l’habitat indigne, nous devons agir plus vite et plus fort »  ",https://www.lemonde.fr/idees/article/2020/10/12/face-a-l-habitat-indigne-nous-devons-agir-plus-vite-et-plus-fort_6055676_3232.html
